[I 2026-04-17 12:45:51,031] Trial 17 finished with value: 1.0 and parameters: {'batch_size': 32, 'latent_dim': 256, 'learning_rate': 0.000865039047402557, 'weight_decay': 0.00017571316967455907, 'dropout': 0.4235789155743181, 'norm': 'batch', 'alpha_wass': 0.7322292657663664, 'alpha_cos': 0.5461714083739457, 'cycle_fwd': 0.7866208342871089, 'cycle_bwd': 0.3046719385306438, 'cycle_bwd_spec': 0.2886723632493202, 'curriculum_start': 0.3343586366387775, 'curriculum_step': 0.09557001559848108, 'use_faiss': False}. Best is trial 0 with value: 1.0.

================================================================================
Training with config: {'batch_size': 64, 'latent_dim': 64, 'learning_rate': 0.004191916189526951, 'weight_decay': 1.602795756801365e-05, 'dropout': 0.2868067351871819, 'norm': 'none', 'alpha_wass': 1.3874272742860088, 'alpha_cos': 0.9469943165032784, 'cycle_fwd': 0.06819498227238474, 'cycle_bwd': 0.6088580236607342, 'cycle_bwd_spec': 0.5577172037618108, 'curriculum_start': 0.6583616775274939, 'curriculum_step': 0.037890506130884585, 'use_faiss': False, 'seed': 0}
Command: python /lisc/home/user/reiser/Nextcloud/studium/computationalScience/thesis/mol/src/machine_learning/main.py --epochs_fwd 10000 --epochs_bwd 10000 --batch 64 --latent 64 --lr 0.004191916189526951 --weight_decay 1.602795756801365e-05 --dropout 0.2868067351871819 --norm none --alpha_wass 1.3874272742860088 --alpha_cos 0.9469943165032784 --cycle_fwd 0.06819498227238474 --cycle_bwd 0.6088580236607342 --cycle_bwd_spec 0.5577172037618108 --curriculum_start 0.6583616775274939 --curriculum_step 0.037890506130884585 --device cuda --seed 0
================================================================================

Warning: Could not extract metrics from output. Using high loss value.
Training process exited with code 1
---- Begin training output tail ----
Traceback (most recent call last):
  File "/lisc/home/user/reiser/Nextcloud/studium/computationalScience/thesis/mol/src/machine_learning/main.py", line 68, in <module>
    from src.machine_learning import utils_mod
  File "/lisc/home/user/reiser/Nextcloud/studium/computationalScience/thesis/mol/src/machine_learning/utils_mod.py", line 21, in <module>
    from .utils.conversions import (
ModuleNotFoundError: No module named 'src.machine_learning.utils'
---- End training output tail ----
[I 2026-04-17 12:46:05,176] Trial 18 finished with value: 1.0 and parameters: {'batch_size': 64, 'latent_dim': 64, 'learning_rate': 0.004191916189526951, 'weight_decay': 1.602795756801365e-05, 'dropout': 0.2868067351871819, 'norm': 'none', 'alpha_wass': 1.3874272742860088, 'alpha_cos': 0.9469943165032784, 'cycle_fwd': 0.06819498227238474, 'cycle_bwd': 0.6088580236607342, 'cycle_bwd_spec': 0.5577172037618108, 'curriculum_start': 0.6583616775274939, 'curriculum_step': 0.037890506130884585, 'use_faiss': False}. Best is trial 0 with value: 1.0.

================================================================================
Training with config: {'batch_size': 128, 'latent_dim': 512, 'learning_rate': 0.0017064662469510226, 'weight_decay': 2.939682835447647e-06, 'dropout': 0.42643126948375176, 'norm': 'layer', 'alpha_wass': 1.030862803695167, 'alpha_cos': 1.4850715608948581, 'cycle_fwd': 0.7071962337750296, 'cycle_bwd': 0.46585682218779473, 'cycle_bwd_spec': 0.6933981942178726, 'curriculum_start': 0.6862191386683563, 'curriculum_step': 0.16855329245443576, 'use_faiss': True, 'seed': 0}
Command: python /lisc/home/user/reiser/Nextcloud/studium/computationalScience/thesis/mol/src/machine_learning/main.py --epochs_fwd 10000 --epochs_bwd 10000 --batch 128 --latent 512 --lr 0.0017064662469510226 --weight_decay 2.939682835447647e-06 --dropout 0.42643126948375176 --norm layer --alpha_wass 1.030862803695167 --alpha_cos 1.4850715608948581 --cycle_fwd 0.7071962337750296 --cycle_bwd 0.46585682218779473 --cycle_bwd_spec 0.6933981942178726 --curriculum_start 0.6862191386683563 --curriculum_step 0.16855329245443576 --device cuda --seed 0 --use_faiss
================================================================================

Warning: Could not extract metrics from output. Using high loss value.
Training process exited with code 1
---- Begin training output tail ----
Traceback (most recent call last):
  File "/lisc/home/user/reiser/Nextcloud/studium/computationalScience/thesis/mol/src/machine_learning/main.py", line 68, in <module>
    from src.machine_learning import utils_mod
  File "/lisc/home/user/reiser/Nextcloud/studium/computationalScience/thesis/mol/src/machine_learning/utils_mod.py", line 21, in <module>
    from .utils.conversions import (
ModuleNotFoundError: No module named 'src.machine_learning.utils'
---- End training output tail ----
[I 2026-04-17 12:46:18,834] Trial 19 finished with value: 1.0 and parameters: {'batch_size': 128, 'latent_dim': 512, 'learning_rate': 0.0017064662469510226, 'weight_decay': 2.939682835447647e-06, 'dropout': 0.42643126948375176, 'norm': 'layer', 'alpha_wass': 1.030862803695167, 'alpha_cos': 1.4850715608948581, 'cycle_fwd': 0.7071962337750296, 'cycle_bwd': 0.46585682218779473, 'cycle_bwd_spec': 0.6933981942178726, 'curriculum_start': 0.6862191386683563, 'curriculum_step': 0.16855329245443576, 'use_faiss': True}. Best is trial 0 with value: 1.0.

================================================================================
OPTIMIZATION COMPLETE
================================================================================

Best Trial: #0
Best Validation Loss: 1.000000
Best Recall@1: 0.0000
Best MRR: 0.0000

Best Hyperparameters:
  batch_size: 64
  latent_dim: 512
  learning_rate: 0.0077801555769014185
  weight_decay: 1.4135935551752307e-05
  dropout: 0.3958625190413323
  norm: none
  alpha_wass: 0.2349685105759852
  alpha_cos: 0.26554566943292734
  cycle_fwd: 0.03001621346592246
  cycle_bwd: 0.8342936470924586
  cycle_bwd_spec: 0.780375183440352
  curriculum_start: 0.7960097185974554
  curriculum_step: 0.19593748502422517
  use_faiss: True
  seed: 0

Full results saved to: /lisc/home/user/reiser/Nextcloud/studium/computationalScience/thesis/mol/outputs/best_params/best_hyperparams.json
Bayesian optimization complete!
Results saved to: best_hyperparams.json

Formatting Results:
Best hyperparameters saved to: /lisc/home/user/reiser/Nextcloud/studium/computationalScience/thesis/mol/best_params/best_hyperparams.txt

Best Metrics:
  val_loss: 1.0
  recall_1: 0.0
  mrr: 0.0

Best Hyperparameters:
  batch_size: 64
  latent_dim: 512
  learning_rate: 0.0077801555769014185
  weight_decay: 1.4135935551752307e-05
  dropout: 0.3958625190413323
  norm: none
  alpha_wass: 0.2349685105759852
  alpha_cos: 0.26554566943292734
  cycle_fwd: 0.03001621346592246
  cycle_bwd: 0.8342936470924586
  cycle_bwd_spec: 0.780375183440352
  curriculum_start: 0.7960097185974554
  curriculum_step: 0.19593748502422517
  use_faiss: True
  seed: 0
Best hyperparameters saved to: /lisc/home/user/reiser/Nextcloud/studium/computationalScience/thesis/mol/best_params/best_hyperparams.sh

Best Metrics:
  val_loss: 1.0
  recall_1: 0.0
  mrr: 0.0

Best Hyperparameters:
  batch_size: 64
  latent_dim: 512
  learning_rate: 0.0077801555769014185
  weight_decay: 1.4135935551752307e-05
  dropout: 0.3958625190413323
  norm: none
  alpha_wass: 0.2349685105759852
  alpha_cos: 0.26554566943292734
  cycle_fwd: 0.03001621346592246
  cycle_bwd: 0.8342936470924586
  cycle_bwd_spec: 0.780375183440352
  curriculum_start: 0.7960097185974554
  curriculum_step: 0.19593748502422517
  use_faiss: True
  seed: 0
Best parameters formatted!

Next Steps:
1. Review text report: cat outputs/best_params/best_hyperparams.txt
2. Run final training: ./outputs/best_params/best_hyperparams.sh --epochs_fwd 100 --epochs_bwd 100

======================================================================
Completed: Fri Apr 17 12:46:19 PM CEST 2026
======================================================================

