##LiSC job info: the temporary directory of your job is also available read-only until 3 days after job end on the login nodes (login01/login02) under this path: /lisc/slurm/node-g06/tmp/slurm-2600266
##LiSC GPU info: IDs 1 on node-g06
======================================================================
Hyperparameter Optimization Job with Optuna
======================================================================
Epochs (forward): 10000
Epochs (backward): 10000
Started: Fri Apr 17 12:41:31 PM CEST 2026
======================================================================

Intelligent exploration of high dimensional hyperparameter space


Starting hyperparameter optimization with 20 trials...
Epochs (forward): 10000, Epochs (backward): 10000
Device: cuda


================================================================================
Training with config: {'batch_size': 64, 'latent_dim': 512, 'learning_rate': 0.0077801555769014185, 'weight_decay': 1.4135935551752307e-05, 'dropout': 0.3958625190413323, 'norm': 'none', 'alpha_wass': 0.2349685105759852, 'alpha_cos': 0.26554566943292734, 'cycle_fwd': 0.03001621346592246, 'cycle_bwd': 0.8342936470924586, 'cycle_bwd_spec': 0.780375183440352, 'curriculum_start': 0.7960097185974554, 'curriculum_step': 0.19593748502422517, 'use_faiss': True, 'seed': 0}
Command: python /lisc/home/user/reiser/Nextcloud/studium/computationalScience/thesis/mol/src/machine_learning/main.py --epochs_fwd 10000 --epochs_bwd 10000 --batch 64 --latent 512 --lr 0.0077801555769014185 --weight_decay 1.4135935551752307e-05 --dropout 0.3958625190413323 --norm none --alpha_wass 0.2349685105759852 --alpha_cos 0.26554566943292734 --cycle_fwd 0.03001621346592246 --cycle_bwd 0.8342936470924586 --cycle_bwd_spec 0.780375183440352 --curriculum_start 0.7960097185974554 --curriculum_step 0.19593748502422517 --device cuda --seed 0 --use_faiss
================================================================================

Warning: Could not extract metrics from output. Using high loss value.
Training process exited with code 1
---- Begin training output tail ----
Traceback (most recent call last):
  File "/lisc/home/user/reiser/Nextcloud/studium/computationalScience/thesis/mol/src/machine_learning/main.py", line 68, in <module>
    from src.machine_learning import utils_mod
  File "/lisc/home/user/reiser/Nextcloud/studium/computationalScience/thesis/mol/src/machine_learning/__init__.py", line 1, in <module>
    from .target_peaks import clean_spectra
ModuleNotFoundError: No module named 'src.machine_learning.target_peaks'
---- End training output tail ----
[I 2026-04-17 12:41:55,659] Trial 0 finished with value: 1.0 and parameters: {'batch_size': 64, 'latent_dim': 512, 'learning_rate': 0.0077801555769014185, 'weight_decay': 1.4135935551752307e-05, 'dropout': 0.3958625190413323, 'norm': 'none', 'alpha_wass': 0.2349685105759852, 'alpha_cos': 0.26554566943292734, 'cycle_fwd': 0.03001621346592246, 'cycle_bwd': 0.8342936470924586, 'cycle_bwd_spec': 0.780375183440352, 'curriculum_start': 0.7960097185974554, 'curriculum_step': 0.19593748502422517, 'use_faiss': True}. Best is trial 0 with value: 1.0.

================================================================================
Training with config: {'batch_size': 32, 'latent_dim': 64, 'learning_rate': 0.0021023308743480106, 'weight_decay': 2.3358825194833545e-05, 'dropout': 0.28421697443432425, 'norm': 'batch', 'alpha_wass': 1.2721745940620381, 'alpha_cos': 1.8931213491777859, 'cycle_fwd': 0.6850020961124486, 'cycle_bwd': 0.36591282156804816, 'cycle_bwd_spec': 0.442661634261348, 'curriculum_start': 0.6581049567418119, 'curriculum_step': 0.021442839609561268, 'use_faiss': False, 'seed': 0}
Command: python /lisc/home/user/reiser/Nextcloud/studium/computationalScience/thesis/mol/src/machine_learning/main.py --epochs_fwd 10000 --epochs_bwd 10000 --batch 32 --latent 64 --lr 0.0021023308743480106 --weight_decay 2.3358825194833545e-05 --dropout 0.28421697443432425 --norm batch --alpha_wass 1.2721745940620381 --alpha_cos 1.8931213491777859 --cycle_fwd 0.6850020961124486 --cycle_bwd 0.36591282156804816 --cycle_bwd_spec 0.442661634261348 --curriculum_start 0.6581049567418119 --curriculum_step 0.021442839609561268 --device cuda --seed 0
================================================================================

Warning: Could not extract metrics from output. Using high loss value.
Training process exited with code 1
---- Begin training output tail ----
Traceback (most recent call last):
  File "/lisc/home/user/reiser/Nextcloud/studium/computationalScience/thesis/mol/src/machine_learning/main.py", line 68, in <module>
    from src.machine_learning import utils_mod
  File "/lisc/home/user/reiser/Nextcloud/studium/computationalScience/thesis/mol/src/machine_learning/__init__.py", line 1, in <module>
    from .target_peaks import clean_spectra
ModuleNotFoundError: No module named 'src.machine_learning.target_peaks'
---- End training output tail ----
[I 2026-04-17 12:42:10,068] Trial 1 finished with value: 1.0 and parameters: {'batch_size': 32, 'latent_dim': 64, 'learning_rate': 0.0021023308743480106, 'weight_decay': 2.3358825194833545e-05, 'dropout': 0.28421697443432425, 'norm': 'batch', 'alpha_wass': 1.2721745940620381, 'alpha_cos': 1.8931213491777859, 'cycle_fwd': 0.6850020961124486, 'cycle_bwd': 0.36591282156804816, 'cycle_bwd_spec': 0.442661634261348, 'curriculum_start': 0.6581049567418119, 'curriculum_step': 0.021442839609561268, 'use_faiss': False}. Best is trial 0 with value: 1.0.

================================================================================
Training with config: {'batch_size': 256, 'latent_dim': 256, 'learning_rate': 4.232824558620121e-05, 'weight_decay': 3.0473936177363887e-06, 'dropout': 0.3265541627326992, 'norm': 'batch', 'alpha_wass': 0.40204220892648745, 'alpha_cos': 0.30971276821217975, 'cycle_fwd': 0.6597662935706207, 'cycle_bwd': 0.14680112183512767, 'cycle_bwd_spec': 0.20461653806325297, 'curriculum_start': 0.3949801365287713, 'curriculum_step': 0.16598871367110768, 'use_faiss': False, 'seed': 0}
Command: python /lisc/home/user/reiser/Nextcloud/studium/computationalScience/thesis/mol/src/machine_learning/main.py --epochs_fwd 10000 --epochs_bwd 10000 --batch 256 --latent 256 --lr 4.232824558620121e-05 --weight_decay 3.0473936177363887e-06 --dropout 0.3265541627326992 --norm batch --alpha_wass 0.40204220892648745 --alpha_cos 0.30971276821217975 --cycle_fwd 0.6597662935706207 --cycle_bwd 0.14680112183512767 --cycle_bwd_spec 0.20461653806325297 --curriculum_start 0.3949801365287713 --curriculum_step 0.16598871367110768 --device cuda --seed 0
================================================================================

Warning: Could not extract metrics from output. Using high loss value.
Training process exited with code 1
---- Begin training output tail ----
Traceback (most recent call last):
  File "/lisc/home/user/reiser/Nextcloud/studium/computationalScience/thesis/mol/src/machine_learning/main.py", line 68, in <module>
    from src.machine_learning import utils_mod
  File "/lisc/home/user/reiser/Nextcloud/studium/computationalScience/thesis/mol/src/machine_learning/__init__.py", line 1, in <module>
    from .target_peaks import clean_spectra
ModuleNotFoundError: No module named 'src.machine_learning.target_peaks'
---- End training output tail ----
[I 2026-04-17 12:42:23,508] Trial 2 finished with value: 1.0 and parameters: {'batch_size': 256, 'latent_dim': 256, 'learning_rate': 4.232824558620121e-05, 'weight_decay': 3.0473936177363887e-06, 'dropout': 0.3265541627326992, 'norm': 'batch', 'alpha_wass': 0.40204220892648745, 'alpha_cos': 0.30971276821217975, 'cycle_fwd': 0.6597662935706207, 'cycle_bwd': 0.14680112183512767, 'cycle_bwd_spec': 0.20461653806325297, 'curriculum_start': 0.3949801365287713, 'curriculum_step': 0.16598871367110768, 'use_faiss': False}. Best is trial 0 with value: 1.0.

================================================================================
Training with config: {'batch_size': 256, 'latent_dim': 128, 'learning_rate': 2.293980298131184e-05, 'weight_decay': 7.734292502064649e-06, 'dropout': 0.05936385947712203, 'norm': 'batch', 'alpha_wass': 1.4156970268030378, 'alpha_cos': 1.1765427629924927, 'cycle_fwd': 0.272735596030051, 'cycle_bwd': 0.5280155729320327, 'cycle_bwd_spec': 0.10300110565085725, 'curriculum_start': 0.5607571964449435, 'curriculum_step': 0.18656627753948068, 'use_faiss': False, 'seed': 0}
Command: python /lisc/home/user/reiser/Nextcloud/studium/computationalScience/thesis/mol/src/machine_learning/main.py --epochs_fwd 10000 --epochs_bwd 10000 --batch 256 --latent 128 --lr 2.293980298131184e-05 --weight_decay 7.734292502064649e-06 --dropout 0.05936385947712203 --norm batch --alpha_wass 1.4156970268030378 --alpha_cos 1.1765427629924927 --cycle_fwd 0.272735596030051 --cycle_bwd 0.5280155729320327 --cycle_bwd_spec 0.10300110565085725 --curriculum_start 0.5607571964449435 --curriculum_step 0.18656627753948068 --device cuda --seed 0
================================================================================

Warning: Could not extract metrics from output. Using high loss value.
Training process exited with code 1
---- Begin training output tail ----
Traceback (most recent call last):
  File "/lisc/home/user/reiser/Nextcloud/studium/computationalScience/thesis/mol/src/machine_learning/main.py", line 68, in <module>
    from src.machine_learning import utils_mod
  File "/lisc/home/user/reiser/Nextcloud/studium/computationalScience/thesis/mol/src/machine_learning/__init__.py", line 1, in <module>
    from .target_peaks import clean_spectra
ModuleNotFoundError: No module named 'src.machine_learning.target_peaks'
---- End training output tail ----
[I 2026-04-17 12:42:36,253] Trial 3 finished with value: 1.0 and parameters: {'batch_size': 256, 'latent_dim': 128, 'learning_rate': 2.293980298131184e-05, 'weight_decay': 7.734292502064649e-06, 'dropout': 0.05936385947712203, 'norm': 'batch', 'alpha_wass': 1.4156970268030378, 'alpha_cos': 1.1765427629924927, 'cycle_fwd': 0.272735596030051, 'cycle_bwd': 0.5280155729320327, 'cycle_bwd_spec': 0.10300110565085725, 'curriculum_start': 0.5607571964449435, 'curriculum_step': 0.18656627753948068, 'use_faiss': False}. Best is trial 0 with value: 1.0.

================================================================================
Training with config: {'batch_size': 64, 'latent_dim': 256, 'learning_rate': 0.0010800642976741364, 'weight_decay': 6.456897906217102e-06, 'dropout': 0.36759701106129744, 'norm': 'layer', 'alpha_wass': 1.224879669416494, 'alpha_cos': 1.1872786210026594, 'cycle_fwd': 0.23085081631421214, 'cycle_bwd': 0.9532215214018152, 'cycle_bwd_spec': 0.45265412483145107, 'curriculum_start': 0.7771269379769022, 'curriculum_step': 0.14290106231032582, 'use_faiss': False, 'seed': 0}
Command: python /lisc/home/user/reiser/Nextcloud/studium/computationalScience/thesis/mol/src/machine_learning/main.py --epochs_fwd 10000 --epochs_bwd 10000 --batch 64 --latent 256 --lr 0.0010800642976741364 --weight_decay 6.456897906217102e-06 --dropout 0.36759701106129744 --norm layer --alpha_wass 1.224879669416494 --alpha_cos 1.1872786210026594 --cycle_fwd 0.23085081631421214 --cycle_bwd 0.9532215214018152 --cycle_bwd_spec 0.45265412483145107 --curriculum_start 0.7771269379769022 --curriculum_step 0.14290106231032582 --device cuda --seed 0
================================================================================

Warning: Could not extract metrics from output. Using high loss value.
Training process exited with code 1
---- Begin training output tail ----
Traceback (most recent call last):
  File "/lisc/home/user/reiser/Nextcloud/studium/computationalScience/thesis/mol/src/machine_learning/main.py", line 68, in <module>
    from src.machine_learning import utils_mod
  File "/lisc/home/user/reiser/Nextcloud/studium/computationalScience/thesis/mol/src/machine_learning/__init__.py", line 1, in <module>
    from .target_peaks import clean_spectra
ModuleNotFoundError: No module named 'src.machine_learning.target_peaks'
---- End training output tail ----
[I 2026-04-17 12:42:49,193] Trial 4 finished with value: 1.0 and parameters: {'batch_size': 64, 'latent_dim': 256, 'learning_rate': 0.0010800642976741364, 'weight_decay': 6.456897906217102e-06, 'dropout': 0.36759701106129744, 'norm': 'layer', 'alpha_wass': 1.224879669416494, 'alpha_cos': 1.1872786210026594, 'cycle_fwd': 0.23085081631421214, 'cycle_bwd': 0.9532215214018152, 'cycle_bwd_spec': 0.45265412483145107, 'curriculum_start': 0.7771269379769022, 'curriculum_step': 0.14290106231032582, 'use_faiss': False}. Best is trial 0 with value: 1.0.

================================================================================
Training with config: {'batch_size': 256, 'latent_dim': 512, 'learning_rate': 0.0008550088256963299, 'weight_decay': 1.8688099841937907e-05, 'dropout': 0.3031966070639622, 'norm': 'none', 'alpha_wass': 0.6511474536998437, 'alpha_cos': 1.274229315097799, 'cycle_fwd': 0.4344810139363085, 'cycle_bwd': 0.14411932358022572, 'cycle_bwd_spec': 0.3052995026964705, 'curriculum_start': 0.555971928561012, 'curriculum_step': 0.12226582463715291, 'use_faiss': False, 'seed': 0}
Command: python /lisc/home/user/reiser/Nextcloud/studium/computationalScience/thesis/mol/src/machine_learning/main.py --epochs_fwd 10000 --epochs_bwd 10000 --batch 256 --latent 512 --lr 0.0008550088256963299 --weight_decay 1.8688099841937907e-05 --dropout 0.3031966070639622 --norm none --alpha_wass 0.6511474536998437 --alpha_cos 1.274229315097799 --cycle_fwd 0.4344810139363085 --cycle_bwd 0.14411932358022572 --cycle_bwd_spec 0.3052995026964705 --curriculum_start 0.555971928561012 --curriculum_step 0.12226582463715291 --device cuda --seed 0
================================================================================

Warning: Could not extract metrics from output. Using high loss value.
Training process exited with code 1
---- Begin training output tail ----
Traceback (most recent call last):
  File "/lisc/home/user/reiser/Nextcloud/studium/computationalScience/thesis/mol/src/machine_learning/main.py", line 68, in <module>
    from src.machine_learning import utils_mod
  File "/lisc/home/user/reiser/Nextcloud/studium/computationalScience/thesis/mol/src/machine_learning/__init__.py", line 1, in <module>
    from .target_peaks import clean_spectra
ModuleNotFoundError: No module named 'src.machine_learning.target_peaks'
---- End training output tail ----
[I 2026-04-17 12:43:02,294] Trial 5 finished with value: 1.0 and parameters: {'batch_size': 256, 'latent_dim': 512, 'learning_rate': 0.0008550088256963299, 'weight_decay': 1.8688099841937907e-05, 'dropout': 0.3031966070639622, 'norm': 'none', 'alpha_wass': 0.6511474536998437, 'alpha_cos': 1.274229315097799, 'cycle_fwd': 0.4344810139363085, 'cycle_bwd': 0.14411932358022572, 'cycle_bwd_spec': 0.3052995026964705, 'curriculum_start': 0.555971928561012, 'curriculum_step': 0.12226582463715291, 'use_faiss': False}. Best is trial 0 with value: 1.0.

================================================================================
Training with config: {'batch_size': 128, 'latent_dim': 128, 'learning_rate': 1.9983919055737704e-05, 'weight_decay': 0.0005733869986337063, 'dropout': 0.3571206497745557, 'norm': 'layer', 'alpha_wass': 0.40873657588511214, 'alpha_cos': 1.269563172139304, 'cycle_fwd': 0.13258178302094709, 'cycle_bwd': 0.849528147029012, 'cycle_bwd_spec': 0.8092457691377606, 'curriculum_start': 0.5552805908916747, 'curriculum_step': 0.08736482647293993, 'use_faiss': False, 'seed': 0}
Command: python /lisc/home/user/reiser/Nextcloud/studium/computationalScience/thesis/mol/src/machine_learning/main.py --epochs_fwd 10000 --epochs_bwd 10000 --batch 128 --latent 128 --lr 1.9983919055737704e-05 --weight_decay 0.0005733869986337063 --dropout 0.3571206497745557 --norm layer --alpha_wass 0.40873657588511214 --alpha_cos 1.269563172139304 --cycle_fwd 0.13258178302094709 --cycle_bwd 0.849528147029012 --cycle_bwd_spec 0.8092457691377606 --curriculum_start 0.5552805908916747 --curriculum_step 0.08736482647293993 --device cuda --seed 0
================================================================================

Warning: Could not extract metrics from output. Using high loss value.
Training process exited with code 1
---- Begin training output tail ----
Traceback (most recent call last):
  File "/lisc/home/user/reiser/Nextcloud/studium/computationalScience/thesis/mol/src/machine_learning/main.py", line 68, in <module>
    from src.machine_learning import utils_mod
  File "/lisc/home/user/reiser/Nextcloud/studium/computationalScience/thesis/mol/src/machine_learning/__init__.py", line 1, in <module>
    from .target_peaks import clean_spectra
ModuleNotFoundError: No module named 'src.machine_learning.target_peaks'
---- End training output tail ----
[I 2026-04-17 12:43:16,497] Trial 6 finished with value: 1.0 and parameters: {'batch_size': 128, 'latent_dim': 128, 'learning_rate': 1.9983919055737704e-05, 'weight_decay': 0.0005733869986337063, 'dropout': 0.3571206497745557, 'norm': 'layer', 'alpha_wass': 0.40873657588511214, 'alpha_cos': 1.269563172139304, 'cycle_fwd': 0.13258178302094709, 'cycle_bwd': 0.849528147029012, 'cycle_bwd_spec': 0.8092457691377606, 'curriculum_start': 0.5552805908916747, 'curriculum_step': 0.08736482647293993, 'use_faiss': False}. Best is trial 0 with value: 1.0.

================================================================================
Training with config: {'batch_size': 256, 'latent_dim': 64, 'learning_rate': 3.2725706551202686e-05, 'weight_decay': 3.6568725005088794e-05, 'dropout': 0.027168994169626814, 'norm': 'none', 'alpha_wass': 0.5254569073147223, 'alpha_cos': 0.7561681933241151, 'cycle_fwd': 0.928800480530935, 'cycle_bwd': 0.7073702579042974, 'cycle_bwd_spec': 0.04152054023599477, 'curriculum_start': 0.2317553251983302, 'curriculum_step': 0.12808089628495506, 'use_faiss': True, 'seed': 0}
Command: python /lisc/home/user/reiser/Nextcloud/studium/computationalScience/thesis/mol/src/machine_learning/main.py --epochs_fwd 10000 --epochs_bwd 10000 --batch 256 --latent 64 --lr 3.2725706551202686e-05 --weight_decay 3.6568725005088794e-05 --dropout 0.027168994169626814 --norm none --alpha_wass 0.5254569073147223 --alpha_cos 0.7561681933241151 --cycle_fwd 0.928800480530935 --cycle_bwd 0.7073702579042974 --cycle_bwd_spec 0.04152054023599477 --curriculum_start 0.2317553251983302 --curriculum_step 0.12808089628495506 --device cuda --seed 0 --use_faiss
================================================================================

Warning: Could not extract metrics from output. Using high loss value.
Training process exited with code 1
---- Begin training output tail ----
Traceback (most recent call last):
  File "/lisc/home/user/reiser/Nextcloud/studium/computationalScience/thesis/mol/src/machine_learning/main.py", line 68, in <module>
    from src.machine_learning import utils_mod
  File "/lisc/home/user/reiser/Nextcloud/studium/computationalScience/thesis/mol/src/machine_learning/__init__.py", line 1, in <module>
    from .target_peaks import clean_spectra
ModuleNotFoundError: No module named 'src.machine_learning.target_peaks'
---- End training output tail ----
[I 2026-04-17 12:43:29,444] Trial 7 finished with value: 1.0 and parameters: {'batch_size': 256, 'latent_dim': 64, 'learning_rate': 3.2725706551202686e-05, 'weight_decay': 3.6568725005088794e-05, 'dropout': 0.027168994169626814, 'norm': 'none', 'alpha_wass': 0.5254569073147223, 'alpha_cos': 0.7561681933241151, 'cycle_fwd': 0.928800480530935, 'cycle_bwd': 0.7073702579042974, 'cycle_bwd_spec': 0.04152054023599477, 'curriculum_start': 0.2317553251983302, 'curriculum_step': 0.12808089628495506, 'use_faiss': True}. Best is trial 0 with value: 1.0.

================================================================================
Training with config: {'batch_size': 32, 'latent_dim': 64, 'learning_rate': 3.618920291309288e-05, 'weight_decay': 0.000680953050813684, 'dropout': 0.3697753975246438, 'norm': 'layer', 'alpha_wass': 0.21025540461536368, 'alpha_cos': 0.9253915885604294, 'cycle_fwd': 0.31867792317416155, 'cycle_bwd': 0.6993800539273048, 'cycle_bwd_spec': 0.3839743208995561, 'curriculum_start': 0.24368294204770785, 'curriculum_step': 0.014688958394352934, 'use_faiss': False, 'seed': 0}
Command: python /lisc/home/user/reiser/Nextcloud/studium/computationalScience/thesis/mol/src/machine_learning/main.py --epochs_fwd 10000 --epochs_bwd 10000 --batch 32 --latent 64 --lr 3.618920291309288e-05 --weight_decay 0.000680953050813684 --dropout 0.3697753975246438 --norm layer --alpha_wass 0.21025540461536368 --alpha_cos 0.9253915885604294 --cycle_fwd 0.31867792317416155 --cycle_bwd 0.6993800539273048 --cycle_bwd_spec 0.3839743208995561 --curriculum_start 0.24368294204770785 --curriculum_step 0.014688958394352934 --device cuda --seed 0
================================================================================

Warning: Could not extract metrics from output. Using high loss value.
Training process exited with code 1
---- Begin training output tail ----
Traceback (most recent call last):
  File "/lisc/home/user/reiser/Nextcloud/studium/computationalScience/thesis/mol/src/machine_learning/main.py", line 68, in <module>
    from src.machine_learning import utils_mod
  File "/lisc/home/user/reiser/Nextcloud/studium/computationalScience/thesis/mol/src/machine_learning/__init__.py", line 1, in <module>
    from .target_peaks import clean_spectra
ModuleNotFoundError: No module named 'src.machine_learning.target_peaks'
---- End training output tail ----
