[I 2026-04-17 12:43:42,897] Trial 8 finished with value: 1.0 and parameters: {'batch_size': 32, 'latent_dim': 64, 'learning_rate': 3.618920291309288e-05, 'weight_decay': 0.000680953050813684, 'dropout': 0.3697753975246438, 'norm': 'layer', 'alpha_wass': 0.21025540461536368, 'alpha_cos': 0.9253915885604294, 'cycle_fwd': 0.31867792317416155, 'cycle_bwd': 0.6993800539273048, 'cycle_bwd_spec': 0.3839743208995561, 'curriculum_start': 0.24368294204770785, 'curriculum_step': 0.014688958394352934, 'use_faiss': False}. Best is trial 0 with value: 1.0.

================================================================================
Training with config: {'batch_size': 256, 'latent_dim': 128, 'learning_rate': 0.0018842388825327857, 'weight_decay': 9.121188950410502e-06, 'dropout': 0.19173194708594898, 'norm': 'batch', 'alpha_wass': 1.758036245350051, 'alpha_cos': 0.6197298661497079, 'cycle_fwd': 0.800066365573438, 'cycle_bwd': 0.19377958486289268, 'cycle_bwd_spec': 0.9532637404022252, 'curriculum_start': 0.6499906211102522, 'curriculum_step': 0.050946458651576106, 'use_faiss': True, 'seed': 0}
Command: python /lisc/home/user/reiser/Nextcloud/studium/computationalScience/thesis/mol/src/machine_learning/main.py --epochs_fwd 10000 --epochs_bwd 10000 --batch 256 --latent 128 --lr 0.0018842388825327857 --weight_decay 9.121188950410502e-06 --dropout 0.19173194708594898 --norm batch --alpha_wass 1.758036245350051 --alpha_cos 0.6197298661497079 --cycle_fwd 0.800066365573438 --cycle_bwd 0.19377958486289268 --cycle_bwd_spec 0.9532637404022252 --curriculum_start 0.6499906211102522 --curriculum_step 0.050946458651576106 --device cuda --seed 0 --use_faiss
================================================================================

Warning: Could not extract metrics from output. Using high loss value.
Training process exited with code 1
---- Begin training output tail ----
Traceback (most recent call last):
  File "/lisc/home/user/reiser/Nextcloud/studium/computationalScience/thesis/mol/src/machine_learning/main.py", line 68, in <module>
    from src.machine_learning import utils_mod
  File "/lisc/home/user/reiser/Nextcloud/studium/computationalScience/thesis/mol/src/machine_learning/__init__.py", line 1, in <module>
    from .target_peaks import clean_spectra
ModuleNotFoundError: No module named 'src.machine_learning.target_peaks'
---- End training output tail ----
[I 2026-04-17 12:43:56,486] Trial 9 finished with value: 1.0 and parameters: {'batch_size': 256, 'latent_dim': 128, 'learning_rate': 0.0018842388825327857, 'weight_decay': 9.121188950410502e-06, 'dropout': 0.19173194708594898, 'norm': 'batch', 'alpha_wass': 1.758036245350051, 'alpha_cos': 0.6197298661497079, 'cycle_fwd': 0.800066365573438, 'cycle_bwd': 0.19377958486289268, 'cycle_bwd_spec': 0.9532637404022252, 'curriculum_start': 0.6499906211102522, 'curriculum_step': 0.050946458651576106, 'use_faiss': True}. Best is trial 0 with value: 1.0.

================================================================================
Training with config: {'batch_size': 64, 'latent_dim': 512, 'learning_rate': 0.007216635702812189, 'weight_decay': 9.343540253959058e-05, 'dropout': 0.48125127691651176, 'norm': 'none', 'alpha_wass': 0.9049457834496963, 'alpha_cos': 0.28117188246020464, 'cycle_fwd': 0.022918455613801847, 'cycle_bwd': 0.9939800254634317, 'cycle_bwd_spec': 0.6774016553574244, 'curriculum_start': 0.8844203402483514, 'curriculum_step': 0.1998508237695999, 'use_faiss': True, 'seed': 0}
Command: python /lisc/home/user/reiser/Nextcloud/studium/computationalScience/thesis/mol/src/machine_learning/main.py --epochs_fwd 10000 --epochs_bwd 10000 --batch 64 --latent 512 --lr 0.007216635702812189 --weight_decay 9.343540253959058e-05 --dropout 0.48125127691651176 --norm none --alpha_wass 0.9049457834496963 --alpha_cos 0.28117188246020464 --cycle_fwd 0.022918455613801847 --cycle_bwd 0.9939800254634317 --cycle_bwd_spec 0.6774016553574244 --curriculum_start 0.8844203402483514 --curriculum_step 0.1998508237695999 --device cuda --seed 0 --use_faiss
================================================================================

Warning: Could not extract metrics from output. Using high loss value.
Training process exited with code 1
---- Begin training output tail ----
Traceback (most recent call last):
  File "/lisc/home/user/reiser/Nextcloud/studium/computationalScience/thesis/mol/src/machine_learning/main.py", line 68, in <module>
    from src.machine_learning import utils_mod
  File "/lisc/home/user/reiser/Nextcloud/studium/computationalScience/thesis/mol/src/machine_learning/__init__.py", line 1, in <module>
    from .target_peaks import clean_spectra
ModuleNotFoundError: No module named 'src.machine_learning.target_peaks'
---- End training output tail ----
[I 2026-04-17 12:44:11,473] Trial 10 finished with value: 1.0 and parameters: {'batch_size': 64, 'latent_dim': 512, 'learning_rate': 0.007216635702812189, 'weight_decay': 9.343540253959058e-05, 'dropout': 0.48125127691651176, 'norm': 'none', 'alpha_wass': 0.9049457834496963, 'alpha_cos': 0.28117188246020464, 'cycle_fwd': 0.022918455613801847, 'cycle_bwd': 0.9939800254634317, 'cycle_bwd_spec': 0.6774016553574244, 'curriculum_start': 0.8844203402483514, 'curriculum_step': 0.1998508237695999, 'use_faiss': True}. Best is trial 0 with value: 1.0.

================================================================================
Training with config: {'batch_size': 32, 'latent_dim': 64, 'learning_rate': 0.008490310640367035, 'weight_decay': 1.0394186004739015e-06, 'dropout': 0.17022257047442974, 'norm': 'batch', 'alpha_wass': 1.6434679264315397, 'alpha_cos': 1.936878098038394, 'cycle_fwd': 0.614557312189394, 'cycle_bwd': 0.4069887275621438, 'cycle_bwd_spec': 0.6287832586441948, 'curriculum_start': 0.7380242809741738, 'curriculum_step': 0.0740924657575088, 'use_faiss': True, 'seed': 0}
Command: python /lisc/home/user/reiser/Nextcloud/studium/computationalScience/thesis/mol/src/machine_learning/main.py --epochs_fwd 10000 --epochs_bwd 10000 --batch 32 --latent 64 --lr 0.008490310640367035 --weight_decay 1.0394186004739015e-06 --dropout 0.17022257047442974 --norm batch --alpha_wass 1.6434679264315397 --alpha_cos 1.936878098038394 --cycle_fwd 0.614557312189394 --cycle_bwd 0.4069887275621438 --cycle_bwd_spec 0.6287832586441948 --curriculum_start 0.7380242809741738 --curriculum_step 0.0740924657575088 --device cuda --seed 0 --use_faiss
================================================================================

Warning: Could not extract metrics from output. Using high loss value.
Training process exited with code 1
---- Begin training output tail ----
Traceback (most recent call last):
  File "/lisc/home/user/reiser/Nextcloud/studium/computationalScience/thesis/mol/src/machine_learning/main.py", line 68, in <module>
    from src.machine_learning import utils_mod
  File "/lisc/home/user/reiser/Nextcloud/studium/computationalScience/thesis/mol/src/machine_learning/utils_mod.py", line 21, in <module>
    from .utils.conversions import (
ModuleNotFoundError: No module named 'src.machine_learning.utils'
---- End training output tail ----
[I 2026-04-17 12:44:25,154] Trial 11 finished with value: 1.0 and parameters: {'batch_size': 32, 'latent_dim': 64, 'learning_rate': 0.008490310640367035, 'weight_decay': 1.0394186004739015e-06, 'dropout': 0.17022257047442974, 'norm': 'batch', 'alpha_wass': 1.6434679264315397, 'alpha_cos': 1.936878098038394, 'cycle_fwd': 0.614557312189394, 'cycle_bwd': 0.4069887275621438, 'cycle_bwd_spec': 0.6287832586441948, 'curriculum_start': 0.7380242809741738, 'curriculum_step': 0.0740924657575088, 'use_faiss': True}. Best is trial 0 with value: 1.0.

================================================================================
Training with config: {'batch_size': 64, 'latent_dim': 512, 'learning_rate': 0.003600530887548282, 'weight_decay': 8.285447101843735e-05, 'dropout': 0.4886492619819097, 'norm': 'none', 'alpha_wass': 0.9200680497476316, 'alpha_cos': 1.9381845576219177, 'cycle_fwd': 0.516432796762562, 'cycle_bwd': 0.4147288457331686, 'cycle_bwd_spec': 0.5733488636082321, 'curriculum_start': 0.8701821980409457, 'curriculum_step': 0.015355726981108236, 'use_faiss': True, 'seed': 0}
Command: python /lisc/home/user/reiser/Nextcloud/studium/computationalScience/thesis/mol/src/machine_learning/main.py --epochs_fwd 10000 --epochs_bwd 10000 --batch 64 --latent 512 --lr 0.003600530887548282 --weight_decay 8.285447101843735e-05 --dropout 0.4886492619819097 --norm none --alpha_wass 0.9200680497476316 --alpha_cos 1.9381845576219177 --cycle_fwd 0.516432796762562 --cycle_bwd 0.4147288457331686 --cycle_bwd_spec 0.5733488636082321 --curriculum_start 0.8701821980409457 --curriculum_step 0.015355726981108236 --device cuda --seed 0 --use_faiss
================================================================================

Warning: Could not extract metrics from output. Using high loss value.
Training process exited with code 1
---- Begin training output tail ----
Traceback (most recent call last):
  File "/lisc/home/user/reiser/Nextcloud/studium/computationalScience/thesis/mol/src/machine_learning/main.py", line 68, in <module>
    from src.machine_learning import utils_mod
  File "/lisc/home/user/reiser/Nextcloud/studium/computationalScience/thesis/mol/src/machine_learning/utils_mod.py", line 21, in <module>
    from .utils.conversions import (
ModuleNotFoundError: No module named 'src.machine_learning.utils'
---- End training output tail ----
[I 2026-04-17 12:44:38,852] Trial 12 finished with value: 1.0 and parameters: {'batch_size': 64, 'latent_dim': 512, 'learning_rate': 0.003600530887548282, 'weight_decay': 8.285447101843735e-05, 'dropout': 0.4886492619819097, 'norm': 'none', 'alpha_wass': 0.9200680497476316, 'alpha_cos': 1.9381845576219177, 'cycle_fwd': 0.516432796762562, 'cycle_bwd': 0.4147288457331686, 'cycle_bwd_spec': 0.5733488636082321, 'curriculum_start': 0.8701821980409457, 'curriculum_step': 0.015355726981108236, 'use_faiss': True}. Best is trial 0 with value: 1.0.

================================================================================
Training with config: {'batch_size': 32, 'latent_dim': 64, 'learning_rate': 0.0002685426848766203, 'weight_decay': 4.977399648164015e-05, 'dropout': 0.23933746686334265, 'norm': 'none', 'alpha_wass': 1.9678017242306425, 'alpha_cos': 1.626596927232463, 'cycle_fwd': 0.7583647852180732, 'cycle_bwd': 0.33213374035900783, 'cycle_bwd_spec': 0.795772837922622, 'curriculum_start': 0.7288121878284866, 'curriculum_step': 0.059345196738581935, 'use_faiss': True, 'seed': 0}
Command: python /lisc/home/user/reiser/Nextcloud/studium/computationalScience/thesis/mol/src/machine_learning/main.py --epochs_fwd 10000 --epochs_bwd 10000 --batch 32 --latent 64 --lr 0.0002685426848766203 --weight_decay 4.977399648164015e-05 --dropout 0.23933746686334265 --norm none --alpha_wass 1.9678017242306425 --alpha_cos 1.626596927232463 --cycle_fwd 0.7583647852180732 --cycle_bwd 0.33213374035900783 --cycle_bwd_spec 0.795772837922622 --curriculum_start 0.7288121878284866 --curriculum_step 0.059345196738581935 --device cuda --seed 0 --use_faiss
================================================================================

Warning: Could not extract metrics from output. Using high loss value.
Training process exited with code 1
---- Begin training output tail ----
Traceback (most recent call last):
  File "/lisc/home/user/reiser/Nextcloud/studium/computationalScience/thesis/mol/src/machine_learning/main.py", line 68, in <module>
    from src.machine_learning import utils_mod
  File "/lisc/home/user/reiser/Nextcloud/studium/computationalScience/thesis/mol/src/machine_learning/utils_mod.py", line 21, in <module>
    from .utils.conversions import (
ModuleNotFoundError: No module named 'src.machine_learning.utils'
---- End training output tail ----
[I 2026-04-17 12:44:52,800] Trial 13 finished with value: 1.0 and parameters: {'batch_size': 32, 'latent_dim': 64, 'learning_rate': 0.0002685426848766203, 'weight_decay': 4.977399648164015e-05, 'dropout': 0.23933746686334265, 'norm': 'none', 'alpha_wass': 1.9678017242306425, 'alpha_cos': 1.626596927232463, 'cycle_fwd': 0.7583647852180732, 'cycle_bwd': 0.33213374035900783, 'cycle_bwd_spec': 0.795772837922622, 'curriculum_start': 0.7288121878284866, 'curriculum_step': 0.059345196738581935, 'use_faiss': True}. Best is trial 0 with value: 1.0.

================================================================================
Training with config: {'batch_size': 128, 'latent_dim': 512, 'learning_rate': 0.000310747005074255, 'weight_decay': 0.00022888555707151523, 'dropout': 0.42502950538695317, 'norm': 'batch', 'alpha_wass': 1.1596940286059478, 'alpha_cos': 1.5746795965521674, 'cycle_fwd': 0.9976948667030269, 'cycle_bwd': 0.5982155846737175, 'cycle_bwd_spec': 0.7630768754155275, 'curriculum_start': 0.4423020761505462, 'curriculum_step': 0.10522546819066719, 'use_faiss': False, 'seed': 0}
Command: python /lisc/home/user/reiser/Nextcloud/studium/computationalScience/thesis/mol/src/machine_learning/main.py --epochs_fwd 10000 --epochs_bwd 10000 --batch 128 --latent 512 --lr 0.000310747005074255 --weight_decay 0.00022888555707151523 --dropout 0.42502950538695317 --norm batch --alpha_wass 1.1596940286059478 --alpha_cos 1.5746795965521674 --cycle_fwd 0.9976948667030269 --cycle_bwd 0.5982155846737175 --cycle_bwd_spec 0.7630768754155275 --curriculum_start 0.4423020761505462 --curriculum_step 0.10522546819066719 --device cuda --seed 0
================================================================================

Warning: Could not extract metrics from output. Using high loss value.
Training process exited with code 1
---- Begin training output tail ----
Traceback (most recent call last):
  File "/lisc/home/user/reiser/Nextcloud/studium/computationalScience/thesis/mol/src/machine_learning/main.py", line 68, in <module>
    from src.machine_learning import utils_mod
  File "/lisc/home/user/reiser/Nextcloud/studium/computationalScience/thesis/mol/src/machine_learning/utils_mod.py", line 21, in <module>
    from .utils.conversions import (
ModuleNotFoundError: No module named 'src.machine_learning.utils'
---- End training output tail ----
[I 2026-04-17 12:45:06,424] Trial 14 finished with value: 1.0 and parameters: {'batch_size': 128, 'latent_dim': 512, 'learning_rate': 0.000310747005074255, 'weight_decay': 0.00022888555707151523, 'dropout': 0.42502950538695317, 'norm': 'batch', 'alpha_wass': 1.1596940286059478, 'alpha_cos': 1.5746795965521674, 'cycle_fwd': 0.9976948667030269, 'cycle_bwd': 0.5982155846737175, 'cycle_bwd_spec': 0.7630768754155275, 'curriculum_start': 0.4423020761505462, 'curriculum_step': 0.10522546819066719, 'use_faiss': False}. Best is trial 0 with value: 1.0.

================================================================================
Training with config: {'batch_size': 32, 'latent_dim': 64, 'learning_rate': 0.0031775792325687236, 'weight_decay': 1.836156915828397e-05, 'dropout': 0.24520973533754534, 'norm': 'none', 'alpha_wass': 0.10375820355813381, 'alpha_cos': 0.12241201944228106, 'cycle_fwd': 0.4442501291331053, 'cycle_bwd': 0.8025299816939353, 'cycle_bwd_spec': 0.9210675961605158, 'curriculum_start': 0.6552141400584806, 'curriculum_step': 0.155115381066524, 'use_faiss': True, 'seed': 0}
Command: python /lisc/home/user/reiser/Nextcloud/studium/computationalScience/thesis/mol/src/machine_learning/main.py --epochs_fwd 10000 --epochs_bwd 10000 --batch 32 --latent 64 --lr 0.0031775792325687236 --weight_decay 1.836156915828397e-05 --dropout 0.24520973533754534 --norm none --alpha_wass 0.10375820355813381 --alpha_cos 0.12241201944228106 --cycle_fwd 0.4442501291331053 --cycle_bwd 0.8025299816939353 --cycle_bwd_spec 0.9210675961605158 --curriculum_start 0.6552141400584806 --curriculum_step 0.155115381066524 --device cuda --seed 0 --use_faiss
================================================================================

Warning: Could not extract metrics from output. Using high loss value.
Training process exited with code 1
---- Begin training output tail ----
Traceback (most recent call last):
  File "/lisc/home/user/reiser/Nextcloud/studium/computationalScience/thesis/mol/src/machine_learning/main.py", line 68, in <module>
    from src.machine_learning import utils_mod
  File "/lisc/home/user/reiser/Nextcloud/studium/computationalScience/thesis/mol/src/machine_learning/utils_mod.py", line 21, in <module>
    from .utils.conversions import (
ModuleNotFoundError: No module named 'src.machine_learning.utils'
---- End training output tail ----
[I 2026-04-17 12:45:20,472] Trial 15 finished with value: 1.0 and parameters: {'batch_size': 32, 'latent_dim': 64, 'learning_rate': 0.0031775792325687236, 'weight_decay': 1.836156915828397e-05, 'dropout': 0.24520973533754534, 'norm': 'none', 'alpha_wass': 0.10375820355813381, 'alpha_cos': 0.12241201944228106, 'cycle_fwd': 0.4442501291331053, 'cycle_bwd': 0.8025299816939353, 'cycle_bwd_spec': 0.9210675961605158, 'curriculum_start': 0.6552141400584806, 'curriculum_step': 0.155115381066524, 'use_faiss': True}. Best is trial 0 with value: 1.0.

================================================================================
Training with config: {'batch_size': 64, 'latent_dim': 512, 'learning_rate': 0.00010335617643771733, 'weight_decay': 3.201906696490747e-06, 'dropout': 0.11917101059089599, 'norm': 'batch', 'alpha_wass': 1.427669048174868, 'alpha_cos': 1.6019867484186892, 'cycle_fwd': 0.5907645381314878, 'cycle_bwd': 0.015542690201991782, 'cycle_bwd_spec': 0.4900087467628275, 'curriculum_start': 0.8130480990293414, 'curriculum_step': 0.041249012321424375, 'use_faiss': True, 'seed': 0}
Command: python /lisc/home/user/reiser/Nextcloud/studium/computationalScience/thesis/mol/src/machine_learning/main.py --epochs_fwd 10000 --epochs_bwd 10000 --batch 64 --latent 512 --lr 0.00010335617643771733 --weight_decay 3.201906696490747e-06 --dropout 0.11917101059089599 --norm batch --alpha_wass 1.427669048174868 --alpha_cos 1.6019867484186892 --cycle_fwd 0.5907645381314878 --cycle_bwd 0.015542690201991782 --cycle_bwd_spec 0.4900087467628275 --curriculum_start 0.8130480990293414 --curriculum_step 0.041249012321424375 --device cuda --seed 0 --use_faiss
================================================================================

Warning: Could not extract metrics from output. Using high loss value.
Training process exited with code 1
---- Begin training output tail ----
Traceback (most recent call last):
  File "/lisc/home/user/reiser/Nextcloud/studium/computationalScience/thesis/mol/src/machine_learning/main.py", line 68, in <module>
    from src.machine_learning import utils_mod
  File "/lisc/home/user/reiser/Nextcloud/studium/computationalScience/thesis/mol/src/machine_learning/utils_mod.py", line 21, in <module>
    from .utils.conversions import (
ModuleNotFoundError: No module named 'src.machine_learning.utils'
---- End training output tail ----
[I 2026-04-17 12:45:36,032] Trial 16 finished with value: 1.0 and parameters: {'batch_size': 64, 'latent_dim': 512, 'learning_rate': 0.00010335617643771733, 'weight_decay': 3.201906696490747e-06, 'dropout': 0.11917101059089599, 'norm': 'batch', 'alpha_wass': 1.427669048174868, 'alpha_cos': 1.6019867484186892, 'cycle_fwd': 0.5907645381314878, 'cycle_bwd': 0.015542690201991782, 'cycle_bwd_spec': 0.4900087467628275, 'curriculum_start': 0.8130480990293414, 'curriculum_step': 0.041249012321424375, 'use_faiss': True}. Best is trial 0 with value: 1.0.

================================================================================
Training with config: {'batch_size': 32, 'latent_dim': 256, 'learning_rate': 0.000865039047402557, 'weight_decay': 0.00017571316967455907, 'dropout': 0.4235789155743181, 'norm': 'batch', 'alpha_wass': 0.7322292657663664, 'alpha_cos': 0.5461714083739457, 'cycle_fwd': 0.7866208342871089, 'cycle_bwd': 0.3046719385306438, 'cycle_bwd_spec': 0.2886723632493202, 'curriculum_start': 0.3343586366387775, 'curriculum_step': 0.09557001559848108, 'use_faiss': False, 'seed': 0}
Command: python /lisc/home/user/reiser/Nextcloud/studium/computationalScience/thesis/mol/src/machine_learning/main.py --epochs_fwd 10000 --epochs_bwd 10000 --batch 32 --latent 256 --lr 0.000865039047402557 --weight_decay 0.00017571316967455907 --dropout 0.4235789155743181 --norm batch --alpha_wass 0.7322292657663664 --alpha_cos 0.5461714083739457 --cycle_fwd 0.7866208342871089 --cycle_bwd 0.3046719385306438 --cycle_bwd_spec 0.2886723632493202 --curriculum_start 0.3343586366387775 --curriculum_step 0.09557001559848108 --device cuda --seed 0
================================================================================

Warning: Could not extract metrics from output. Using high loss value.
Training process exited with code 1
---- Begin training output tail ----
Traceback (most recent call last):
  File "/lisc/home/user/reiser/Nextcloud/studium/computationalScience/thesis/mol/src/machine_learning/main.py", line 68, in <module>
    from src.machine_learning import utils_mod
  File "/lisc/home/user/reiser/Nextcloud/studium/computationalScience/thesis/mol/src/machine_learning/utils_mod.py", line 21, in <module>
    from .utils.conversions import (
ModuleNotFoundError: No module named 'src.machine_learning.utils'
---- End training output tail ----
