[I 2026-04-29 22:19:16,039] Trial 11 finished with value: 1.0 and parameters: {'batch_size': 32, 'latent_dim': 64, 'learning_rate': 0.008490310640367035, 'weight_decay': 1.0394186004739015e-06, 'dropout': 0.17022257047442974, 'norm': 'batch', 'alpha_wass': 1.6434679264315397, 'alpha_cos': 1.936878098038394, 'cycle_fwd': 0.614557312189394, 'cycle_bwd': 0.4069887275621438, 'cycle_bwd_spec': 0.6287832586441948, 'curriculum_start': 0.7380242809741738, 'curriculum_step': 0.0740924657575088, 'use_faiss': True}. Best is trial 0 with value: 1.0.

================================================================================
Training with config: {'batch_size': 64, 'latent_dim': 512, 'learning_rate': 0.003600530887548282, 'weight_decay': 8.285447101843735e-05, 'dropout': 0.4886492619819097, 'norm': 'none', 'alpha_wass': 0.9200680497476316, 'alpha_cos': 1.9381845576219177, 'cycle_fwd': 0.516432796762562, 'cycle_bwd': 0.4147288457331686, 'cycle_bwd_spec': 0.5733488636082321, 'curriculum_start': 0.8701821980409457, 'curriculum_step': 0.015355726981108236, 'use_faiss': True, 'seed': 0}
Command: python /lisc/home/user/reiser/Nextcloud/studium/computationalScience/thesis/mol/src/machine_learning/main.py --epochs_fwd 10000 --epochs_bwd 10000 --batch 64 --latent 512 --lr 0.003600530887548282 --weight_decay 8.285447101843735e-05 --dropout 0.4886492619819097 --norm none --alpha_wass 0.9200680497476316 --alpha_cos 1.9381845576219177 --cycle_fwd 0.516432796762562 --cycle_bwd 0.4147288457331686 --cycle_bwd_spec 0.5733488636082321 --curriculum_start 0.8701821980409457 --curriculum_step 0.015355726981108236 --device cuda --seed 0 --use_faiss
================================================================================

Training timed out!
[I 2026-04-29 23:19:18,405] Trial 12 finished with value: 1.0 and parameters: {'batch_size': 64, 'latent_dim': 512, 'learning_rate': 0.003600530887548282, 'weight_decay': 8.285447101843735e-05, 'dropout': 0.4886492619819097, 'norm': 'none', 'alpha_wass': 0.9200680497476316, 'alpha_cos': 1.9381845576219177, 'cycle_fwd': 0.516432796762562, 'cycle_bwd': 0.4147288457331686, 'cycle_bwd_spec': 0.5733488636082321, 'curriculum_start': 0.8701821980409457, 'curriculum_step': 0.015355726981108236, 'use_faiss': True}. Best is trial 0 with value: 1.0.

================================================================================
Training with config: {'batch_size': 32, 'latent_dim': 64, 'learning_rate': 0.0002685426848766203, 'weight_decay': 4.977399648164015e-05, 'dropout': 0.23933746686334265, 'norm': 'none', 'alpha_wass': 1.9678017242306425, 'alpha_cos': 1.626596927232463, 'cycle_fwd': 0.7583647852180732, 'cycle_bwd': 0.33213374035900783, 'cycle_bwd_spec': 0.795772837922622, 'curriculum_start': 0.7288121878284866, 'curriculum_step': 0.059345196738581935, 'use_faiss': True, 'seed': 0}
Command: python /lisc/home/user/reiser/Nextcloud/studium/computationalScience/thesis/mol/src/machine_learning/main.py --epochs_fwd 10000 --epochs_bwd 10000 --batch 32 --latent 64 --lr 0.0002685426848766203 --weight_decay 4.977399648164015e-05 --dropout 0.23933746686334265 --norm none --alpha_wass 1.9678017242306425 --alpha_cos 1.626596927232463 --cycle_fwd 0.7583647852180732 --cycle_bwd 0.33213374035900783 --cycle_bwd_spec 0.795772837922622 --curriculum_start 0.7288121878284866 --curriculum_step 0.059345196738581935 --device cuda --seed 0 --use_faiss
================================================================================

Training timed out!
[I 2026-04-30 00:19:20,551] Trial 13 finished with value: 1.0 and parameters: {'batch_size': 32, 'latent_dim': 64, 'learning_rate': 0.0002685426848766203, 'weight_decay': 4.977399648164015e-05, 'dropout': 0.23933746686334265, 'norm': 'none', 'alpha_wass': 1.9678017242306425, 'alpha_cos': 1.626596927232463, 'cycle_fwd': 0.7583647852180732, 'cycle_bwd': 0.33213374035900783, 'cycle_bwd_spec': 0.795772837922622, 'curriculum_start': 0.7288121878284866, 'curriculum_step': 0.059345196738581935, 'use_faiss': True}. Best is trial 0 with value: 1.0.

================================================================================
Training with config: {'batch_size': 128, 'latent_dim': 512, 'learning_rate': 0.000310747005074255, 'weight_decay': 0.00022888555707151523, 'dropout': 0.42502950538695317, 'norm': 'batch', 'alpha_wass': 1.1596940286059478, 'alpha_cos': 1.5746795965521674, 'cycle_fwd': 0.9976948667030269, 'cycle_bwd': 0.5982155846737175, 'cycle_bwd_spec': 0.7630768754155275, 'curriculum_start': 0.4423020761505462, 'curriculum_step': 0.10522546819066719, 'use_faiss': False, 'seed': 0}
Command: python /lisc/home/user/reiser/Nextcloud/studium/computationalScience/thesis/mol/src/machine_learning/main.py --epochs_fwd 10000 --epochs_bwd 10000 --batch 128 --latent 512 --lr 0.000310747005074255 --weight_decay 0.00022888555707151523 --dropout 0.42502950538695317 --norm batch --alpha_wass 1.1596940286059478 --alpha_cos 1.5746795965521674 --cycle_fwd 0.9976948667030269 --cycle_bwd 0.5982155846737175 --cycle_bwd_spec 0.7630768754155275 --curriculum_start 0.4423020761505462 --curriculum_step 0.10522546819066719 --device cuda --seed 0
================================================================================

Training timed out!
[I 2026-04-30 01:19:22,849] Trial 14 finished with value: 1.0 and parameters: {'batch_size': 128, 'latent_dim': 512, 'learning_rate': 0.000310747005074255, 'weight_decay': 0.00022888555707151523, 'dropout': 0.42502950538695317, 'norm': 'batch', 'alpha_wass': 1.1596940286059478, 'alpha_cos': 1.5746795965521674, 'cycle_fwd': 0.9976948667030269, 'cycle_bwd': 0.5982155846737175, 'cycle_bwd_spec': 0.7630768754155275, 'curriculum_start': 0.4423020761505462, 'curriculum_step': 0.10522546819066719, 'use_faiss': False}. Best is trial 0 with value: 1.0.

================================================================================
Training with config: {'batch_size': 32, 'latent_dim': 64, 'learning_rate': 0.0031775792325687236, 'weight_decay': 1.836156915828397e-05, 'dropout': 0.24520973533754534, 'norm': 'none', 'alpha_wass': 0.10375820355813381, 'alpha_cos': 0.12241201944228106, 'cycle_fwd': 0.4442501291331053, 'cycle_bwd': 0.8025299816939353, 'cycle_bwd_spec': 0.9210675961605158, 'curriculum_start': 0.6552141400584806, 'curriculum_step': 0.155115381066524, 'use_faiss': True, 'seed': 0}
Command: python /lisc/home/user/reiser/Nextcloud/studium/computationalScience/thesis/mol/src/machine_learning/main.py --epochs_fwd 10000 --epochs_bwd 10000 --batch 32 --latent 64 --lr 0.0031775792325687236 --weight_decay 1.836156915828397e-05 --dropout 0.24520973533754534 --norm none --alpha_wass 0.10375820355813381 --alpha_cos 0.12241201944228106 --cycle_fwd 0.4442501291331053 --cycle_bwd 0.8025299816939353 --cycle_bwd_spec 0.9210675961605158 --curriculum_start 0.6552141400584806 --curriculum_step 0.155115381066524 --device cuda --seed 0 --use_faiss
================================================================================

Training timed out!
[I 2026-04-30 02:19:25,637] Trial 15 finished with value: 1.0 and parameters: {'batch_size': 32, 'latent_dim': 64, 'learning_rate': 0.0031775792325687236, 'weight_decay': 1.836156915828397e-05, 'dropout': 0.24520973533754534, 'norm': 'none', 'alpha_wass': 0.10375820355813381, 'alpha_cos': 0.12241201944228106, 'cycle_fwd': 0.4442501291331053, 'cycle_bwd': 0.8025299816939353, 'cycle_bwd_spec': 0.9210675961605158, 'curriculum_start': 0.6552141400584806, 'curriculum_step': 0.155115381066524, 'use_faiss': True}. Best is trial 0 with value: 1.0.

================================================================================
Training with config: {'batch_size': 64, 'latent_dim': 512, 'learning_rate': 0.00010335617643771733, 'weight_decay': 3.201906696490747e-06, 'dropout': 0.11917101059089599, 'norm': 'batch', 'alpha_wass': 1.427669048174868, 'alpha_cos': 1.6019867484186892, 'cycle_fwd': 0.5907645381314878, 'cycle_bwd': 0.015542690201991782, 'cycle_bwd_spec': 0.4900087467628275, 'curriculum_start': 0.8130480990293414, 'curriculum_step': 0.041249012321424375, 'use_faiss': True, 'seed': 0}
Command: python /lisc/home/user/reiser/Nextcloud/studium/computationalScience/thesis/mol/src/machine_learning/main.py --epochs_fwd 10000 --epochs_bwd 10000 --batch 64 --latent 512 --lr 0.00010335617643771733 --weight_decay 3.201906696490747e-06 --dropout 0.11917101059089599 --norm batch --alpha_wass 1.427669048174868 --alpha_cos 1.6019867484186892 --cycle_fwd 0.5907645381314878 --cycle_bwd 0.015542690201991782 --cycle_bwd_spec 0.4900087467628275 --curriculum_start 0.8130480990293414 --curriculum_step 0.041249012321424375 --device cuda --seed 0 --use_faiss
================================================================================

Training timed out!
[I 2026-04-30 03:19:27,972] Trial 16 finished with value: 1.0 and parameters: {'batch_size': 64, 'latent_dim': 512, 'learning_rate': 0.00010335617643771733, 'weight_decay': 3.201906696490747e-06, 'dropout': 0.11917101059089599, 'norm': 'batch', 'alpha_wass': 1.427669048174868, 'alpha_cos': 1.6019867484186892, 'cycle_fwd': 0.5907645381314878, 'cycle_bwd': 0.015542690201991782, 'cycle_bwd_spec': 0.4900087467628275, 'curriculum_start': 0.8130480990293414, 'curriculum_step': 0.041249012321424375, 'use_faiss': True}. Best is trial 0 with value: 1.0.

================================================================================
Training with config: {'batch_size': 32, 'latent_dim': 256, 'learning_rate': 0.000865039047402557, 'weight_decay': 0.00017571316967455907, 'dropout': 0.4235789155743181, 'norm': 'batch', 'alpha_wass': 0.7322292657663664, 'alpha_cos': 0.5461714083739457, 'cycle_fwd': 0.7866208342871089, 'cycle_bwd': 0.3046719385306438, 'cycle_bwd_spec': 0.2886723632493202, 'curriculum_start': 0.3343586366387775, 'curriculum_step': 0.09557001559848108, 'use_faiss': False, 'seed': 0}
Command: python /lisc/home/user/reiser/Nextcloud/studium/computationalScience/thesis/mol/src/machine_learning/main.py --epochs_fwd 10000 --epochs_bwd 10000 --batch 32 --latent 256 --lr 0.000865039047402557 --weight_decay 0.00017571316967455907 --dropout 0.4235789155743181 --norm batch --alpha_wass 0.7322292657663664 --alpha_cos 0.5461714083739457 --cycle_fwd 0.7866208342871089 --cycle_bwd 0.3046719385306438 --cycle_bwd_spec 0.2886723632493202 --curriculum_start 0.3343586366387775 --curriculum_step 0.09557001559848108 --device cuda --seed 0
================================================================================

Training timed out!
[I 2026-04-30 04:19:30,230] Trial 17 finished with value: 1.0 and parameters: {'batch_size': 32, 'latent_dim': 256, 'learning_rate': 0.000865039047402557, 'weight_decay': 0.00017571316967455907, 'dropout': 0.4235789155743181, 'norm': 'batch', 'alpha_wass': 0.7322292657663664, 'alpha_cos': 0.5461714083739457, 'cycle_fwd': 0.7866208342871089, 'cycle_bwd': 0.3046719385306438, 'cycle_bwd_spec': 0.2886723632493202, 'curriculum_start': 0.3343586366387775, 'curriculum_step': 0.09557001559848108, 'use_faiss': False}. Best is trial 0 with value: 1.0.

================================================================================
Training with config: {'batch_size': 64, 'latent_dim': 64, 'learning_rate': 0.004191916189526951, 'weight_decay': 1.602795756801365e-05, 'dropout': 0.2868067351871819, 'norm': 'none', 'alpha_wass': 1.3874272742860088, 'alpha_cos': 0.9469943165032784, 'cycle_fwd': 0.06819498227238474, 'cycle_bwd': 0.6088580236607342, 'cycle_bwd_spec': 0.5577172037618108, 'curriculum_start': 0.6583616775274939, 'curriculum_step': 0.037890506130884585, 'use_faiss': False, 'seed': 0}
Command: python /lisc/home/user/reiser/Nextcloud/studium/computationalScience/thesis/mol/src/machine_learning/main.py --epochs_fwd 10000 --epochs_bwd 10000 --batch 64 --latent 64 --lr 0.004191916189526951 --weight_decay 1.602795756801365e-05 --dropout 0.2868067351871819 --norm none --alpha_wass 1.3874272742860088 --alpha_cos 0.9469943165032784 --cycle_fwd 0.06819498227238474 --cycle_bwd 0.6088580236607342 --cycle_bwd_spec 0.5577172037618108 --curriculum_start 0.6583616775274939 --curriculum_step 0.037890506130884585 --device cuda --seed 0
================================================================================

Training timed out!
[I 2026-04-30 05:19:32,389] Trial 18 finished with value: 1.0 and parameters: {'batch_size': 64, 'latent_dim': 64, 'learning_rate': 0.004191916189526951, 'weight_decay': 1.602795756801365e-05, 'dropout': 0.2868067351871819, 'norm': 'none', 'alpha_wass': 1.3874272742860088, 'alpha_cos': 0.9469943165032784, 'cycle_fwd': 0.06819498227238474, 'cycle_bwd': 0.6088580236607342, 'cycle_bwd_spec': 0.5577172037618108, 'curriculum_start': 0.6583616775274939, 'curriculum_step': 0.037890506130884585, 'use_faiss': False}. Best is trial 0 with value: 1.0.

================================================================================
Training with config: {'batch_size': 128, 'latent_dim': 512, 'learning_rate': 0.0017064662469510226, 'weight_decay': 2.939682835447647e-06, 'dropout': 0.42643126948375176, 'norm': 'layer', 'alpha_wass': 1.030862803695167, 'alpha_cos': 1.4850715608948581, 'cycle_fwd': 0.7071962337750296, 'cycle_bwd': 0.46585682218779473, 'cycle_bwd_spec': 0.6933981942178726, 'curriculum_start': 0.6862191386683563, 'curriculum_step': 0.16855329245443576, 'use_faiss': True, 'seed': 0}
Command: python /lisc/home/user/reiser/Nextcloud/studium/computationalScience/thesis/mol/src/machine_learning/main.py --epochs_fwd 10000 --epochs_bwd 10000 --batch 128 --latent 512 --lr 0.0017064662469510226 --weight_decay 2.939682835447647e-06 --dropout 0.42643126948375176 --norm layer --alpha_wass 1.030862803695167 --alpha_cos 1.4850715608948581 --cycle_fwd 0.7071962337750296 --cycle_bwd 0.46585682218779473 --cycle_bwd_spec 0.6933981942178726 --curriculum_start 0.6862191386683563 --curriculum_step 0.16855329245443576 --device cuda --seed 0 --use_faiss
================================================================================

Training timed out!
[I 2026-04-30 06:19:34,745] Trial 19 finished with value: 1.0 and parameters: {'batch_size': 128, 'latent_dim': 512, 'learning_rate': 0.0017064662469510226, 'weight_decay': 2.939682835447647e-06, 'dropout': 0.42643126948375176, 'norm': 'layer', 'alpha_wass': 1.030862803695167, 'alpha_cos': 1.4850715608948581, 'cycle_fwd': 0.7071962337750296, 'cycle_bwd': 0.46585682218779473, 'cycle_bwd_spec': 0.6933981942178726, 'curriculum_start': 0.6862191386683563, 'curriculum_step': 0.16855329245443576, 'use_faiss': True}. Best is trial 0 with value: 1.0.
